<?xml version="1.0" encoding="UTF-8"?>
<!--
Copyright (C) 2014 Jean-Christophe Malapert

This program is free software: you can redistribute it and/or modify
it under the terms of the GNU General Public License as published by
the Free Software Foundation, either version 3 of the License, or
(at your option) any later version.

This program is distributed in the hope that it will be useful,
but WITHOUT ANY WARRANTY; without even the implied warranty of
MERCHANTABILITY or FITNESS FOR A PARTICULAR PURPOSE.  See the
GNU General Public License for more details.

You should have received a copy of the GNU General Public License
along with this program.  If not, see <http://www.gnu.org/licenses/>.
-->

<xsd:schema xmlns:xsd="http://www.w3.org/2001/XMLSchema"
            targetNamespace="http://xml.netbeans.org/schema/workflow"
    xmlns:tns="http://xml.netbeans.org/schema/workflow"
    elementFormDefault="qualified">
    <xsd:element name="workflow">
        <xsd:complexType>
            <xsd:sequence>
                <xsd:element name="description" minOccurs="0"/>
                <xsd:element name="task" maxOccurs="unbounded">
                    <xsd:complexType>
                        <xsd:sequence>
                            <xsd:element name="arg" maxOccurs="unbounded" minOccurs="0">
                                <xsd:complexType>
                                    <xsd:choice>
                                        <xsd:element name="string" type="xsd:string"/>
                                        <xsd:element name="boolean" type="xsd:boolean"/>
                                        <xsd:element name="file" type="xsd:string"/>
                                    </xsd:choice>
                                </xsd:complexType>
                            </xsd:element>
                        </xsd:sequence>
                        <xsd:attribute name="name" type="xsd:string" use="required"/>
                        <xsd:attribute name="version" type="xsd:string" use="required"/>
                    </xsd:complexType>
                </xsd:element>
            </xsd:sequence>
            <xsd:attribute name="name" type="xsd:string"/>
            <xsd:attribute name="version" type="xsd:string"/>
        </xsd:complexType>
    </xsd:element>
</xsd:schema>